blob_sha	source_scope	disposition_document	publication
43e7ab1757d39dfd4b0319b82a6094d038472fde	R1 export GPU safety initial open review	2026-07-23-historical-r1-export-gpu-safety-lineage-recovery.md	codex/historical-recovery-unit5a-export-gpu-safety
6dc46037f189c1982d20cbbcd24ccb687e746d49	R1 export GPU safety all-checkbox revision	2026-07-23-historical-r1-export-gpu-safety-lineage-recovery.md	codex/historical-recovery-unit5a-export-gpu-safety
b285e5933357071a41a2cef45fb3f90074e67c08	R1 export GPU safety motoly rename revision	2026-07-23-historical-r1-export-gpu-safety-lineage-recovery.md	codex/historical-recovery-unit5a-export-gpu-safety
3b825db60956391bf669b83ee7aec834822367e3	R1 export GPU safety motolii rename revision	2026-07-23-historical-r1-export-gpu-safety-lineage-recovery.md	codex/historical-recovery-unit5a-export-gpu-safety
0ec3ad11b8d7f0b04ef77cab9a640b2cf6135993	R1 export GPU safety missed findings and audit-process addendum	2026-07-23-historical-r1-export-gpu-safety-lineage-recovery.md	codex/historical-recovery-unit5a-export-gpu-safety
